{
  "name": "Ravel",
  "author": "Ravel Contributors",
  "url": "https://github.com/NaruseNia/ravel",
  "themes": [
    {
      "name": "Ravel Light",
      "mode": "light",
      "is_default": true,
      "shadow": false,
      "font.size": 14,
      "font.family": "Geist",
      "mono_font.size": 12,
      "mono_font.family": "JetBrains Mono",
      "radius": 4,
      "radius.lg": 6,
      "colors": {
        "accent.background": "#E0E0E0",
        "accent.foreground": "#000000",
        "background": "#F9F9F9",
        "foreground": "#000000",
        "border": "#D2D2D2",
        "ring": "#5B6EE1",
        "danger.foreground": "#FFFFFF",
        "danger.background": "#d21f07",
        "info.background": "#007E8A",
        "drop_target.background": "#5B6EE133",
        "list.active.background": "#5B6EE115",
        "list.active.border": "#5B6EE1",
        "list.even.background": "#EFEFEF",
        "list.hover.background": "#E7E7E7",
        "muted.background": "#EAEAEA",
        "muted.foreground": "#707070",
        "popover.background": "#F5F5F5",
        "popover.foreground": "#000000",
        "primary.background": "#5B6EE1",
        "primary.foreground": "#FFFFFF",
        "scrollbar.background": "#FFFFFF00",
        "scrollbar.thumb.background": "#C8C8C8",
        "secondary.active.background": "#D9D9D9",
        "secondary.background": "#E0E0E0",
        "secondary.foreground": "#000000",
        "secondary.hover.background": "#E5E5E5",
        "tab.active.foreground": "#000000",
        "tab.background": "#E9E9E9",
        "tab.foreground": "#606060",
        "tab_bar.background": "#E9E9E9",
        "title_bar.background": "#FEFEFE",
        "title_bar.border": "#DADADA",
        "status_bar.background": "#E9E9E9",
        "base.yellow": "#B59A00",
        "base.red": "#d21f07",
        "base.blue": "#5B6EE1",
        "base.green": "#319a00",
        "base.magenta": "#9A0068",
        "base.cyan": "#007E8A"
      },
      "highlight": {
        "editor.foreground": "#000000",
        "editor.background": "#ffffff",
        "editor.active_line.background": "#F5F5F5",
        "editor.line_number": "#929292",
        "editor.active_line_number": "#000000",
        "editor.invisible": "#007fff66",
        "conflict": "#d21f07",
        "created": "#5B6EE1",
        "hidden": "#6D6D6D",
        "hint": "#9A0068",
        "modified": "#319a00",
        "predictive": "#A4ABB6",
        "warning": "#B59A00",
        "syntax": {
          "attribute": {
            "color": "#957931"
          },
          "boolean": {
            "color": "#C5060B"
          },
          "comment": {
            "color": "#007fff"
          },
          "comment.doc": {
            "color": "#007fff"
          },
          "constant": {
            "color": "#C5060B"
          },
          "constructor": {
            "color": "#0433ff"
          },
          "embedded": {
            "color": "#333333"
          },
          "function": {
            "color": "#0000A2"
          },
          "keyword": {
            "color": "#0433ff"
          },
          "link_text": {
            "color": "#0000A2",
            "font_style": "normal"
          },
          "link_uri": {
            "color": "#6A7293",
            "font_style": "italic"
          },
          "number": {
            "color": "#0433ff"
          },
          "string": {
            "color": "#036A07"
          },
          "string.escape": {
            "color": "#036A07"
          },
          "string.regex": {
            "color": "#036A07"
          },
          "string.special": {
            "color": "#d21f07"
          },
          "string.special.symbol": {
            "color": "#d21f07"
          },
          "tag": {
            "color": "#0433ff"
          },
          "text.literal": {
            "color": "#6F42C1"
          },
          "title": {
            "color": "#5B6EE1"
          },
          "type": {
            "color": "#6f42c1"
          },
          "property": {
            "color": "#333333"
          },
          "variable": {
            "color": "#333333"
          },
          "variable.special": {
            "color": "#C5060B"
          }
        }
      }
    },
    {
      "name": "Ravel Dark",
      "mode": "dark",
      "is_default": true,
      "shadow": false,
      "font.size": 14,
      "font.family": "Geist",
      "mono_font.size": 12,
      "mono_font.family": "JetBrains Mono",
      "radius": 4,
      "radius.lg": 6,
      "colors": {
        "accent.background": "#282629",
        "accent.foreground": "#CACCCA",
        "background": "#131313",
        "border": "#303030",
        "ring": "#5B6EE1",
        "foreground": "#DEDEDE",
        "danger.background": "#FF5257",
        "info.background": "#07FDD3",
        "drop_target.background": "#5B6EE133",
        "list.even.background": "#232323",
        "list.active.background": "#5B6EE115",
        "list.active.border": "#5B6EE1",
        "muted.background": "#202020",
        "muted.foreground": "#9D9D9D",
        "popover.background": "#101010",
        "popover.foreground": "#CACCCA",
        "primary.background": "#5B6EE1",
        "primary.foreground": "#F2F9FF",
        "switch.background": "#393939",
        "switch.thumb.background": "#DAECFF",
        "scrollbar.background": "#13131300",
        "scrollbar.thumb.background": "#9F9F9F",
        "secondary.active.background": "#353535",
        "secondary.background": "#353535",
        "secondary.foreground": "#DEDEDE",
        "secondary.hover.background": "#35353599",
        "link": "#419CFF",
        "tab_bar.background": "#1C1C1E",
        "tab.active.background": "#131313",
        "tab.foreground": "#8F8F8F",
        "title_bar.background": "#1C1C1E",
        "selection.background": "#3F638B",
        "base.blue": "#5B6EE1",
        "base.cyan": "#07FDD3",
        "base.green": "#30D158",
        "base.magenta": "#A550A7",
        "base.red": "#FF5257",
        "base.yellow": "#FFC600"
      },
      "highlight": {
        "editor.foreground": "#CACCCA",
        "editor.background": "#131313",
        "editor.active_line.background": "#35343666",
        "editor.line_number": "#8F8F8F",
        "editor.active_line_number": "#DDDDDD",
        "editor.invisible": "#007fff66",
        "conflict": "#D2602D",
        "created": "#5B6EE1",
        "created.background": "#0C4619",
        "deleted.background": "#46190C",
        "error.background": "#46190C",
        "error.border": "#802207",
        "hidden": "#9E9E9E",
        "hint": "#b283f8",
        "hint.background": "#250c4b",
        "hint.border": "#3f0891",
        "info.background": "#0059D1",
        "info.border": "#0059D1",
        "modified": "#B0A878",
        "modified.background": "#3A310E",
        "predictive": "#5D5945",
        "success.background": "#0C4619",
        "warning.background": "#3A310E",
        "warning.border": "#7B6508",
        "syntax": {
          "attribute": {
            "color": "#e7cb8f"
          },
          "boolean": {
            "color": "#E1D797"
          },
          "comment": {
            "color": "#9E9E9E"
          },
          "comment.doc": {
            "color": "#9E9E9E"
          },
          "constant": {
            "color": "#E1D797"
          },
          "constructor": {
            "color": "#b5af9a"
          },
          "embedded": {
            "color": "#CACCCA"
          },
          "function": {
            "color": "#fdd888"
          },
          "keyword": {
            "color": "#c28b12"
          },
          "link_text": {
            "color": "#307BF6",
            "font_style": "normal"
          },
          "link_uri": {
            "color": "#7faef9",
            "font_style": "italic"
          },
          "number": {
            "color": "#E1D797"
          },
          "string": {
            "color": "#62BA46"
          },
          "string.escape": {
            "color": "#62BA46"
          },
          "string.regex": {
            "color": "#62BA46"
          },
          "string.special": {
            "color": "#E1D797"
          },
          "string.special.symbol": {
            "color": "#E1D797"
          },
          "tag": {
            "color": "#b5af9a"
          },
          "text.literal": {
            "color": "#E1D797"
          },
          "title": {
            "color": "#fdd888",
            "font_weight": 600
          },
          "type": {
            "color": "#c75828"
          },
          "property": {
            "color": "#CACCCA"
          },
          "variable.special": {
            "color": "#E19773"
          }
        }
      }
    }
  ]
}
